[
  {
    "parent_id": "activity.diagnostic_bronchoscopy",
    "child_id": "diagnostic_test.cone_beam_ct",
    "edge_type": "part_of",
    "source": "research_memory",
    "confidence": 1.0,
    "sort_order": 0,
    "metadata": {}
  },
  {
    "parent_id": "activity.diagnostic_bronchoscopy",
    "child_id": "diagnostic_test.radial_ebus",
    "edge_type": "part_of",
    "source": "research_memory",
    "confidence": 1.0,
    "sort_order": 0,
    "metadata": {}
  },
  {
    "parent_id": "activity.diagnostic_bronchoscopy",
    "child_id": "procedure.electromagnetic_navigation",
    "edge_type": "part_of",
    "source": "research_memory",
    "confidence": 1.0,
    "sort_order": 0,
    "metadata": {}
  },
  {
    "parent_id": "activity.diagnostic_bronchoscopy",
    "child_id": "procedure.robotic_bronchoscopy",
    "edge_type": "part_of",
    "source": "research_memory",
    "confidence": 1.0,
    "sort_order": 0,
    "metadata": {}
  },
  {
    "parent_id": "activity.diagnostic_bronchoscopy",
    "child_id": "procedure.transbronchial_biopsy",
    "edge_type": "part_of",
    "source": "research_memory",
    "confidence": 1.0,
    "sort_order": 0,
    "metadata": {}
  },
  {
    "parent_id": "activity.mediastinal_staging",
    "child_id": "evidence_field.false_negative_staging",
    "edge_type": "part_of",
    "source": "research_memory",
    "confidence": 1.0,
    "sort_order": 0,
    "metadata": {}
  },
  {
    "parent_id": "activity.mediastinal_staging",
    "child_id": "evidence_field.reference_standard",
    "edge_type": "part_of",
    "source": "research_memory",
    "confidence": 1.0,
    "sort_order": 0,
    "metadata": {}
  },
  {
    "parent_id": "activity.mediastinal_staging",
    "child_id": "evidence_field.staging_sensitivity",
    "edge_type": "part_of",
    "source": "research_memory",
    "confidence": 1.0,
    "sort_order": 0,
    "metadata": {}
  },
  {
    "parent_id": "activity.mediastinal_staging",
    "child_id": "procedure.nodal_sampling",
    "edge_type": "part_of",
    "source": "research_memory",
    "confidence": 1.0,
    "sort_order": 0,
    "metadata": {}
  },
  {
    "parent_id": "activity.mediastinal_staging",
    "child_id": "procedure.surgical_confirmation",
    "edge_type": "part_of",
    "source": "research_memory",
    "confidence": 1.0,
    "sort_order": 0,
    "metadata": {}
  },
  {
    "parent_id": "activity.therapeutic_bronchoscopy",
    "child_id": "device_category.airway_stents",
    "edge_type": "part_of",
    "source": "research_memory",
    "confidence": 1.0,
    "sort_order": 0,
    "metadata": {}
  },
  {
    "parent_id": "activity.therapeutic_bronchoscopy",
    "child_id": "disease.benign_airway_stenosis",
    "edge_type": "part_of",
    "source": "research_memory",
    "confidence": 1.0,
    "sort_order": 0,
    "metadata": {}
  },
  {
    "parent_id": "activity.therapeutic_bronchoscopy",
    "child_id": "disease.hemoptysis",
    "edge_type": "part_of",
    "source": "research_memory",
    "confidence": 1.0,
    "sort_order": 0,
    "metadata": {}
  },
  {
    "parent_id": "activity.therapeutic_bronchoscopy",
    "child_id": "disease.malignant_airway_obstruction",
    "edge_type": "part_of",
    "source": "research_memory",
    "confidence": 1.0,
    "sort_order": 0,
    "metadata": {}
  },
  {
    "parent_id": "activity.therapeutic_bronchoscopy",
    "child_id": "procedure.bronchoscopic_lung_volume_reduction",
    "edge_type": "part_of",
    "source": "research_memory",
    "confidence": 1.0,
    "sort_order": 0,
    "metadata": {}
  },
  {
    "parent_id": "activity.therapeutic_bronchoscopy",
    "child_id": "procedure.debulking_modalities",
    "edge_type": "part_of",
    "source": "research_memory",
    "confidence": 1.0,
    "sort_order": 0,
    "metadata": {}
  },
  {
    "parent_id": "certifying_board.allergy_and_immunology",
    "child_id": "specialty.allergy_and_immunology",
    "edge_type": "offered_by",
    "source": "ABMS",
    "confidence": 1.0,
    "sort_order": 0,
    "metadata": {
      "credential_level": "specialty"
    }
  },
  {
    "parent_id": "certifying_board.anesthesiology",
    "child_id": "specialty.anesthesiology",
    "edge_type": "offered_by",
    "source": "ABMS",
    "confidence": 1.0,
    "sort_order": 0,
    "metadata": {
      "credential_level": "specialty"
    }
  },
  {
    "parent_id": "certifying_board.anesthesiology",
    "child_id": "subspecialty.adult_cardiac_anesthesiology",
    "edge_type": "offered_by",
    "source": "ABMS",
    "confidence": 1.0,
    "sort_order": 0,
    "metadata": {
      "credential_level": "subspecialty",
      "source_offering_name": "Adult Cardiac Anesthesiology",
      "offering_status": "active"
    }
  },
  {
    "parent_id": "certifying_board.anesthesiology",
    "child_id": "subspecialty.critical_care_medicine",
    "edge_type": "offered_by",
    "source": "ABMS",
    "confidence": 1.0,
    "sort_order": 1,
    "metadata": {
      "credential_level": "subspecialty",
      "source_offering_name": "Critical Care Medicine",
      "offering_status": "active"
    }
  },
  {
    "parent_id": "certifying_board.anesthesiology",
    "child_id": "subspecialty.health_care_administration_leadership_and_management",
    "edge_type": "offered_by",
    "source": "ABMS",
    "confidence": 1.0,
    "sort_order": 2,
    "metadata": {
      "credential_level": "subspecialty",
      "source_offering_name": "Health Care Administration, Leadership, and Management",
      "offering_status": "approved_not_yet_issued"
    }
  },
  {
    "parent_id": "certifying_board.anesthesiology",
    "child_id": "subspecialty.hospice_and_palliative_medicine",
    "edge_type": "offered_by",
    "source": "ABMS",
    "confidence": 1.0,
    "sort_order": 3,
    "metadata": {
      "credential_level": "subspecialty",
      "source_offering_name": "Hospice and Palliative Medicine",
      "offering_status": "active"
    }
  },
  {
    "parent_id": "certifying_board.anesthesiology",
    "child_id": "subspecialty.neurocritical_care",
    "edge_type": "offered_by",
    "source": "ABMS",
    "confidence": 1.0,
    "sort_order": 4,
    "metadata": {
      "credential_level": "subspecialty",
      "source_offering_name": "Neurocritical Care",
      "offering_status": "active"
    }
  },
  {
    "parent_id": "certifying_board.anesthesiology",
    "child_id": "subspecialty.pain_medicine",
    "edge_type": "offered_by",
    "source": "ABMS",
    "confidence": 1.0,
    "sort_order": 5,
    "metadata": {
      "credential_level": "subspecialty",
      "source_offering_name": "Pain Medicine",
      "offering_status": "active"
    }
  },
  {
    "parent_id": "certifying_board.anesthesiology",
    "child_id": "subspecialty.pediatric_anesthesiology",
    "edge_type": "offered_by",
    "source": "ABMS",
    "confidence": 1.0,
    "sort_order": 6,
    "metadata": {
      "credential_level": "subspecialty",
      "source_offering_name": "Pediatric Anesthesiology",
      "offering_status": "active"
    }
  },
  {
    "parent_id": "certifying_board.anesthesiology",
    "child_id": "subspecialty.sleep_medicine",
    "edge_type": "offered_by",
    "source": "ABMS",
    "confidence": 1.0,
    "sort_order": 7,
    "metadata": {
      "credential_level": "subspecialty",
      "source_offering_name": "Sleep Medicine",
      "offering_status": "active"
    }
  },
  {
    "parent_id": "certifying_board.colon_and_rectal_surgery",
    "child_id": "specialty.colon_and_rectal_surgery",
    "edge_type": "offered_by",
    "source": "ABMS",
    "confidence": 1.0,
    "sort_order": 0,
    "metadata": {
      "credential_level": "specialty"
    }
  },
  {
    "parent_id": "certifying_board.dermatology",
    "child_id": "specialty.dermatology",
    "edge_type": "offered_by",
    "source": "ABMS",
    "confidence": 1.0,
    "sort_order": 0,
    "metadata": {
      "credential_level": "specialty"
    }
  },
  {
    "parent_id": "certifying_board.dermatology",
    "child_id": "subspecialty.dermatopathology",
    "edge_type": "offered_by",
    "source": "ABMS",
    "confidence": 1.0,
    "sort_order": 0,
    "metadata": {
      "credential_level": "subspecialty",
      "source_offering_name": "Dermatopathology",
      "offering_status": "active"
    }
  },
  {
    "parent_id": "certifying_board.dermatology",
    "child_id": "subspecialty.micrographic_dermatologic_surgery",
    "edge_type": "offered_by",
    "source": "ABMS",
    "confidence": 1.0,
    "sort_order": 1,
    "metadata": {
      "credential_level": "subspecialty",
      "source_offering_name": "Micrographic Dermatologic Surgery",
      "offering_status": "active"
    }
  },
  {
    "parent_id": "certifying_board.dermatology",
    "child_id": "subspecialty.pediatric_dermatology",
    "edge_type": "offered_by",
    "source": "ABMS",
    "confidence": 1.0,
    "sort_order": 2,
    "metadata": {
      "credential_level": "subspecialty",
      "source_offering_name": "Pediatric Dermatology",
      "offering_status": "active"
    }
  },
  {
    "parent_id": "certifying_board.emergency_medicine",
    "child_id": "specialty.emergency_medicine",
    "edge_type": "offered_by",
    "source": "ABMS",
    "confidence": 1.0,
    "sort_order": 0,
    "metadata": {
      "credential_level": "specialty"
    }
  },
  {
    "parent_id": "certifying_board.emergency_medicine",
    "child_id": "subspecialty.critical_care_medicine",
    "edge_type": "offered_by",
    "source": "ABMS",
    "confidence": 1.0,
    "sort_order": 4,
    "metadata": {
      "credential_level": "subspecialty",
      "source_offering_name": "Internal Medicine-Critical Care Medicine",
      "source_offering_names": [
        "Anesthesiology Critical Care Medicine",
        "Internal Medicine-Critical Care Medicine"
      ],
      "source_sort_orders": [
        0,
        4
      ],
      "offering_status": "active"
    }
  },
  {
    "parent_id": "certifying_board.emergency_medicine",
    "child_id": "subspecialty.emergency_medical_services",